id,user_input,uri,doi,title,authors,year,citations_gs
0,"Massey, D., 1991, “A global sense of place” Marxism Today (38) 24-29",http://aughty.org/pdf/global_sense_place.pdf,,A Global Sense of Place,"Massey, Doreen",2010,1989
1,"Lorimer, Hayden. ""Cultural geography: the busyness of being ‘more-than-representational’."" Progress in human geography 29.1 (2005): 83-94.",dx.doi.org/10.1191/0309132505ph531pr,10.1191/0309132505ph531pr,Cultural geography: the busyness of being 'more-than-representational',"Lorimer, Hayden",2005,744
2,http://www.sciencedirect.com/science/article/pii/S0927776508002695,dx.doi.org/10.1016/j.colsurfb.2008.07.004,10.1016/j.colsurfb.2008.07.004,Biodistribution of colloidal gold nanoparticles after intravenous administration: Effect of particle size,"Sonavanea, Ganeshchandra; Tomodaa, Keishiro; Makino, Kimiko",2008,505
3,10.1039/C1CS15166E ,dx.doi.org/10.1039/C1CS15166E ,10.1039/C1CS15166E ,Gold nanoparticles in biomedical applications: recent advances and perspectives,"Dykman, Lev; Khlebtsov, Nikolai",2012,632
4,10.1080/09298219508570672,dx.doi.org/10.1080/09298219508570672,10.1080/09298219508570672,Multiple viewpoint systems for music prediction,"Conklin, Darrell; Wittel, Ian H.",1995,241
5,10.1613/jair.3908,dx.doi.org/10.1613/jair.3908,10.1613/jair.3908,AI methods in algorithmic composition: A comprehensive survey,"Fernandez, Jose D.; Vico, Francisco",2013,49
6,DOI: 10.2307/1913643,dx.doi.org/10.2307/1913643,10.2307/1913643,Regression quantiles,"Koenker, Roger; Bassett, Gilbert Jr.",1978,8246
7,https://eudml.org/doc/265042,http://pldml.icm.edu.pl/pldml/element/bwmeta1.element.desklight-70ba4186-b998-47e3-bd17-b6aef6f371a6/c/bcp23_1_30.pdf,,On the iteration of entire functions,"Eremenko, Alexandre E.",1989,167
8,http://www.ams.org/journals/bull/1993-29-02/S0273-0979-1993-00432-4/,dx.doi.org/10.1090/S0273-0979-1993-00432-4,10.1090/S0273-0979-1993-00432-4,Iteration of meromorphic functions,"Bergweiler, Walter",1993,523
9,http://nlp.stanford.edu/~wcmac/papers/natlog-iwcs09.pdf,dx.doi.org/10.3115/1693756.1693772,10.3115/1693756.1693772,An extended model of natural logic,"MacCartney, Bill; Manning, Christopher D.",2009,80
10,http://oro.open.ac.uk/33236/1/2886-5853-1-PB_%289%29.pdf,dx.doi.org/10.5087/dad.2012.201,10.5087/dad.2012.201,Varieties of question generation: Introduction to this special issue,"Piwek, Paul; Boyer, Kristy Elizabeth",2013,7
11,"Gibson-Graham, J.-K. (2008) Diverse economies: performative practices for ‘other worlds’. Progress in Human Geography 32 (5) pp. 613-632",dx.doi.org/10.1177/0309132508090821,10.1177/0309132508090821,Diverse economies: performative practices for 'other worlds',"Gibson-Graham, J. K.",2008,543
12,"Taylor, J.R. and S. Taylor Lovell (2014) Urban home food gardens in the Global North: Research traditions and future directions. Agriculture and Human Values 31 (2) pp. 285-305",dx.doi.org/10.1007/s10460-013-9475-1,10.1007/s10460-013-9475-1,Urban home food gardens in the Global North: research traditions and future directions,"Taylor, John R.; Lovell, Sarah Taylor",2013,37
13,"Pearce, J.A., Harris, N.B.W. and Tindle, A.G., 1984. Trace element discrimination diagrams for the tectonic interpretation of granitic rocks. Journal of Petrology, 25, 956-983.",dx.doi.org/10.1093/petrology/25.4.956,10.1093/petrology/25.4.956,Trace element discrimination diagrams for the tectonic interpretation of granitic rocks,"Pearce, Julian A.; Harris, Nigel B. W.; Tindle, Andrew G.",1984,5904
14,"Jamieson, R.A., Unsworth, M.J., Harris, N.B.W., Rosenberg, C.L. and Schulmann, K., 2011. Crustal melting and the flow of mountains. In: Sawyer, E.W., Cesare, B. and Brown, M. (eds.): When the Continental Crust Melts. Elements, 7, 251-258.",dx.doi.org/10.2113/gselements.7.4.253,10.2113/gselements.7.4.253,Crustal Melting and the Flow of Mountains,"Jamieson, Rebecca A.; Unsworth, Martyn J.; Harris, Nigel B. W.; Rosenberg, Claudio L.; Schulmann, Karel",2011,58
15,"doi:10.1016/0883-9026(94)00014-X  Entrepreneurship: Productive, unproductive, and destructive,  William J. Baumol (1990)",dx.doi.org/10.1016/0883-9026(94)00014-X,10.1016/0883-9026(94)00014-X,"Entrepreneurship: Productive, unproductive, and destructive","Baumol, William J.",1996,4412
16,"DOI: 10.1111/j.1468-2370.2008.00254.x Researching small firms and entrepreneurship: Past, present and future, Robert Blackburn and Anne Kovalainen, (2009)",dx.doi.org/10.1111/j.1468-2370.2008.00254.x,10.1111/j.1468-2370.2008.00254.x,"Researching small firms and entrepreneurship: Past, present and future","Blackburn, Robert; Kovalainen, Anne",2008,196
17,"The presence of malfolded proteins in the endoplasmic reticulum signals the induction of glucose-regulated proteins Kozutsumi, Y., Segal, M., Normington, K., Gething, M.-J., Sambrook, J., 1988 Nature, 332 (6163), pp. 462-464",dx.doi.org/10.1038/332462a0,10.1038/332462a0,The presence of malfolded proteins in the endoplasmic reticulum signals the induction of glucose-regulated proteins,"Kozutsumi, Yasunori; Segal, Mark; Normington, Karl; Gething, Mary-Jane; Sambrook, Joe",1988,959
18,"Intracellular functions of N-linked glycans Helenius, A., Aebi, M. Science, Volume 291, Issue 5512, 23 March 2001, Pages 2364-2369",dx.doi.org/10.1126/science.291.5512.2364,10.1126/science.291.5512.2364,Intracellular functions of N-linked glycans,"Helenius, Ari; Aebi, Markus",2001,1943
19,10.1088/0963-0252/5/4/009,dx.doi.org/10.1088/0963-0252/5/4/009,10.1088/0963-0252/5/4/009,A novel electrostatic probe method for ion flux measurements,"Braithwaite, Nicholas St John; Booth, Jean-Paul; Cunge, Gilles",1996,146
20,DOI: 10.1149/2.007403jss,dx.doi.org/10.1149/2.007403jss,10.1149/2.007403jss,A review of hydrophilic silicon wafer bonding,"Masteika, V.; Kowal, J.; Braithwaite, N. St J.; Rogers, T.",2014,25
21,http://dx.doi.org/10.1016/j.disc.2005.06.016,dx.doi.org/10.1016/j.disc.2005.06.016,10.1016/j.disc.2005.06.016,Simple permutations and pattern restricted permutations,"Albert, Michael H.; Atkinson, Mike D.",2005,125
22,http://www.combinatorics.org/ojs/index.php/eljc/article/view/DS14,http://www.emis.ams.org/journals/EJC/Surveys/ds14.pdf,,Moore Graphs and Beyond: A survey of the Degree/Diameter Problem,"Miller, Mirka; Siran, Jozef",2005,251
23,WHITTAKE.RH (1965)DOMINANCE AND DIVERSITY IN LAND PLANT COMMUNITIES - NUMERICAL RELATIONS OF SPECIES EXPRESS IMPORTANCE OF COMPETITION IN COMMUNITY FUNCTION AND EVOLUTION. SCIENCE   Volume: 147   Issue: 3655   Pages: 250,dx.doi.org/10.1126/science.147.3655.250,10.1126/science.147.3655.250,Dominance and diversity in land plant communitites,"Whittaker, Robert H.",1965,1348
24,Silvertown J.2004. Plant coexistence and the niche. Trends in Ecology & Evolution 19(11):605-611 DOI: 10.1016/j.tree.2004.09.003 ·,dx.doi.org/10.1016/j.tree.2004.09.003,10.1016/j.tree.2004.09.003,Plant coexistence and the niche,"Silvertown, Jonathan",2004,629
25,"Wallace, Louise M.; Dunn, Orla M.; Alder, Elizabeth M.; Inch, Sally; Hills, Robert K. and Law, Susan M. (2006). A randomised-controlled trial in England of a postnatal midwifery intervention on breast-feeding duration. Midwifery, 22(3) pp. 262–273. http://www.midwiferyjournal.com/article/S0266-6138(05)00064-1/pdf",dx.doi.org/10.1016/j.midw.2005.06.004,10.1016/j.midw.2005.06.004,A randomised-controlled trial in England of a postnatal midwifery intervention on breast-feeding duration,"Wallace, Louise M.; Dunn, Orla M.; Alder, Elizabeth M.; Inch, Sally; Hills, Robert K.; Law, Susan M.",2006,39
26,"Wallace, Louise M.; Evers, Kerry E.; Wareing, Hilary; Dunn, Orla M.; Newby, Kate; Paiva, Andrea and Johnson, Janet L. (2007). Informing school sex education using the stages of change construct: sexual behaviour and attitudes towards sexual activity and condom use of children aged 13-16 in England. Journal of Health Psychology, 12(1) pp. 179–183.",dx.doi.org/10.1177/1359105307071752,10.1177/1359105307071752,Informing School Sex Education Using the Stages of Change Construct: Sexual Behaviour and Attitudes towards Sexual Activity and Condom Use of Children Aged 13–16 in England,"Wallace, Louise M.; Evers, Kerry E.; Wareing, Hilary; Dunn, Orla M.; Newby, Kate; Paiva, Andrea; Johnson, Janet L.",2007,12
27,https://scholar.google.com/citations?view_op=view_citation&hl=en&user=Iw8zRP4AAAAJ&citation_for_view=Iw8zRP4AAAAJ:UmS_249rOGwC,dx.doi.org/10.1051/0004-6361/201014519,10.1051/0004-6361/201014519,The Herschel-SPIRE instrument and its in-flight performance,"Griffin, M. J.; Abergel, A.; Abreu, A.; Ade, P. A. R.; Andre, P.; Augueres, J.-L.; Babbedge, T.; Bae, Y.; Baillie, T.; Baluteau, J.-P.; Barlow, M. J.; Bendo, G.; Benielli, D.; Bock, J. J.; Bonhomme, P.; Brisbin, D.; Brockley-Blatt, C.; Caldwell, M.; Cara, C.; Castro-Rodriguez, N.; Cerulli, R.; Chanial, P.; Chen, S.; Clark, E.; Clements, D. L.; Clerc, L.; Coker, J.; Communal, D.; Conversi, L.; Cox, P.; Crumb, D.; Cunningham, C.; Daly, F.; Davis, G. R.; Antoni, P. De; Delderfield, J.; Devin, N.; Giorgio, A. Di; Didschuns, I.; Dohlen, K.; Donati, M.; Dowell, A.; Dowell, C. D.; Duband, L.; Dumaye, L.; Emery, R. J.; Ferlet, M.; Ferrand, D.; Fontignie, J.; Fox, M.; Franceschini, A.; Frerking, M.; Fulton, T.; Garcia, J.; Gastaud, R.; Gear, W. K.; Glenn, J.; Goizel, A.; Griffin, D. K.; Grundy, T.; Guest, S.; Guillemet, L.; Hargrave, P. C.; Harwit, M.; Hastings, P.; Hatziminaoglou, E.; Herman, M.; Hinde, B.; Hristov, V.; Huang, M.; Imhof, P.; Isaak, K. J.; Israelsson, U.; Ivison, R. J.; Jennings, D.; Kiernan, B.; King, K. J.; Lange, A. E.; Latter, W.; Laurent, G.; Laurent, P.; Leeks, S. J.; Lellouch, E.; Levenson, L.; Li, B.; Li, J.; Lilienthal, J.; Lim, T.; Liu, S. J.; Lu, N.; Madden, S.; Mainetti, G.; Marliani, P.; McKay, D.; Mercier, K.; Molinari, S.; Morris, H.; Moseley, H.; Mulder, J.; Mur, M.; Naylor, D. A.; Nguyen, H.; O'Halloran, B.; Oliver, S.; Olofsson, G.; Olofsson, H.-G.; Orfei, R.; Page, M. J.; Pain, I.; Panuzzo, P.; Papageorgiou, A.; Parks, G.; Parr-Burman, P.; Pearce, A.; Pearson, C.; Perez-Fournon, I.; Pinsard, F.; Pisano, G.; Podosek, J.; Pohlen, M.; Polehampton, E. T.; Pouliquen, D.; Rigopoulou, D.; Rizzo, D.; Roseboom, I. G.; Roussel, H.; Rowan-Robinson, M.; Rownd, B.; Saraceno, P.; Sauvage, M.; Savage, R.; Savini, G.; Sawyer, E.; Scharmberg, C.; Schmitt, D.; Schneider, N.; Schulz, B.; Schwartz, A.; Shafer, R.; Shupe, D. L.; Sibthorpe, B.; Sidher, S.; Smith, A.; Smith, A. J.; Smith, D.; Spencer, L.; Stobie, B.; Sudiwala, R.; Sukhatme, K.; Surace, C.; Stevens, J. A.; Swinyard, B. M.; Trichas, M.; Tourette, T.; Triou, H.; Tseng, S.; Tucker, C.; Turner, A.; Vaccari, M.; Valtchanov, I.; Vigroux, L.; Virique, E.; Voellmer, G.; Walker, H.; Ward, R.; Waskett, T.; Weilert, M.; Wesson, R.; White, G. J.; Whitehouse, N.; Wilson, C. D.; Winter, B.; Woodcraft, A. L.; Wright, G. S.; Xu, C. K.; Zavagno, A.; Zemcov, M.; , L. Zhang; Zonca, E.",2010,1246
28,https://scholar.google.com/citations?view_op=view_citation&hl=en&user=Iw8zRP4AAAAJ&citation_for_view=Iw8zRP4AAAAJ:d1gkVwhDpl0C,dx.doi.org/10.1051/0004-6361/201014666,10.1051/0004-6361/201014666,From filamentary clouds to prestellar cores to the stellar IMF: Initial highlights from the Herschel Gould Belt Survey,"Andre, Ph.; Menshchikov, Alexander; Bontemps, S.; Konyves, V.; Motte, F.; Schneider, N.; Didelon, P.; Minier, V.; Saraceno, P.; Ward-Thompson, Derek; Francesco, J. Di; White, G.; Molinari, S.; Testi, L.; Abergel, A.; Griffin, M.; Henning, Th.; Royer, Pierre; Merin, B.; Vavrek, R.; Attard, M.; Arzoumanian, D.; Wilson, C. D.; Ade, P.; Aussel, H.; Baluteau, J. P.; Benedettini, M.; Bernard, J. Ph.; Blommaert, J. A. D. L.; Cambrésy, L.; Cox, P..; Giorgio, A. Di; Hargrave, P.; Hennemann, M.; Huang, M.; Kirk, J.; Krause, O.; Launhardt, R.; Leeks, S.; Pennec, J. Le; Li, J. Z.; Martin, P. G.; Maury, A.; Olofsson, G.; Omont, A.; Peretto, Nicolas; Pezzuto, S.; Prusti, T.; Roussel, Hervé; Russeil, D.; Sauvage, M.; Sibthorpe, Bruce.; Sicilia-Aguilar, A.; Spinoglio, L.; Waelkens, C.; Woodcraft, A.; Zavagno, A.",2010,580
29,"Regression models and life tables, D.R. Cox, 1972",http://www.jstor.org/stable/pdf/2985181.pdf,,Regression Models and Life-Tables,"Cox, David R.",1972,65
30,"Combining Probability Distributions: A Critique and an Annotated Bibliography, C. Genest and J.V. Zidek, 1986",http://www.jstor.org/stable/pdf/2245510.pdf,,Combining probability distributions: A critique and an annotated bibliography,"Genest, Christian; Zidek, James V.",1986,869
31,"Day, C., Kington, A., Stobart, G. & Sammons, P. (2006). The Personal and professional selves of teachers: stable and unstable identities. British Educational Research Journal, Vol. 32, No.4, pp.601-616.",dx.doi.org/10.1080/01411920600775316,10.1080/01411920600775316,The personal and professional selves of teachers: stable and unstable identities,"Day, Christopher; Kington, Alison; Stobart, Gordon; Sammons, Pam",2006,563
32,"Beijaard, D., Meijer, P.C. & Verloop, N. (2004). Reconsidering research on teachers’ professional identity. Teaching and Teacher Education. Vol.20, pp.107-128.",dx.doi.org/10.1016/j.tate.2003.07.001,10.1016/j.tate.2003.07.001,Reconsidering research on teachers' professional identity,"Beijaard, Douwe; Meijer, Paulien C.; Verloop, Nico",2004,1494
33,"Raghuram, Parvati; Henry, Leroi and Bornat, Joanna (2010). Difference and distinction? Non-migrant and migrant networks. Sociology, 44(4) pp. 623–641.",dx.doi.org/10.1177/0038038510369360,10.1177/0038038510369360,Difference and Distinction? Non-migrant and Migrant Networks,"Raghuram, Parvati; Henry, Leroi; Bornat, Joanna",2010,22
34,"Bornat, J. (2003). A Second take: revisiting interviews with a different purpose. Oral History, 31(1) pp. 47–53.",http://oro.open.ac.uk/id/eprint/6107,,A Second take: revisiting interviews with a different purpose,"Bornat, Joanna",2003,53
35,http://www.sciencedirect.com/science/article/pii/S0001691811000503,dx.doi.org/10.1016/j.actpsy.2011.03.003,10.1016/j.actpsy.2011.03.003,Sex differences in unfamiliar face identification: Evidence from matching tasks,"Megreya, Ahmed M.; Bindemann, Markus; Havard, Catriona",2011,43
36,http://www.tandfonline.com/doi/abs/10.1080/10683160903524333#.V43QtvkrJNA,dx.doi.org/10.1080/10683160903524333,10.1080/10683160903524333,A field evaluation of the VIPER system: A new technique for eliciting eyewitness identification evidence,"Memon, Amina; Havard, Catriona; Clifford, Brain; Gabbert, Fiona; Watt, Moray",2011,30
37,DOI: http://dx.doi.org/10.1016/j.neuron.2004.11.005,dx.doi.org/10.1016/j.neuron.2004.11.005,10.1016/j.neuron.2004.11.005,Mutations in LRRK2 Cause Autosomal-Dominant Parkinsonism with Pleomorphic Pathology,"Zimprich, Alexander; Biskup, Saskia; Leitner, Petra; Lichtner, Peter; Farrer, Matthew; Lincoln, Sarah; Kachergus, Jennifer; Hulihan, Mary; Uitti, Ryan J.; Calne, Donald B.; Stoessl, A. Jon; Pfeiffer, Ronald F.;  Patenge, Nadja; Carbajal, Iria Carballo; Vieregge, Peter; Asmus, Friedrich; Muller-Myhsok, Bertram; Dickson, Dennis W.; Meitinger, Thomas; Strom, Tim M.; Wszolek, Zbigniew K.; Gasser, Thomas",2004,1758
38,doi: 10.1042/AN20090007.,dx.doi.org/10.1042/AN20090007,10.1042/AN20090007,Leucine-rich repeat kinase 2 mutations and Parkinson's disease: three questions,"Greggio, Elisa; Cookson, Mark R.",2009,194
39,http://ro.uow.edu.au/compsciwp/14,http://citeseerx.ist.psu.edu/viewdoc/download;jsessionid=EA6CF0C3D015F31D70F94784CF844048?doi=10.1.1.376.4768&rep=rep1&type=pdf,,A model for communicating sequential process,"Hoare, Charles Antony Richard",1980,196
40,Process Algebra for Synchronous Communication J. A. BERGSTRA AND J. W. KLOP 1984,dx.doi.org/10.1016/S0019-9958(84)80025-X,10.1016/S0019-9958(84)80025-X,Process algebra for synchronous communication,"Bergstra, Jan A.; Klop, Jan Willem",1984,1165
41,10.1109/23.490905,dx.doi.org/10.1109/23.490905,10.1109/23.490905,Proton Effects in Charge-Coupled Devices,"Hopkinson, G. R.; Dale, C. J.; Marshall, P. W.",1996,172
42,10.1109/TNS.2003.813197,dx.doi.org/10.1109/TNS.2003.813197,10.1109/TNS.2003.813197,Review of displacement damage effects in silicon devices,"Srour, J. R., Marshall, Cheryl J., Marshall, Paul W.",2003,373
43,"Whittle, Jon, et al. ""RELAX: a language to address uncertainty in self-adaptive systems requirement."" Requirements Engineering 15.2 (2010): 177-196.",dx.doi.org/10.1007/s00766-010-0101-0,10.1007/s00766-010-0101-0,RELAX: a language to address uncertainty in self-adaptive systems requirement,"Whittle, Jon; Sawyer, Pete; Bencomo, Nelly; Cheng, Betty HC; Bruel, Jean-Michel",2010,98
44,"Spanoudakis, George, and Andrea Zisman. ""Inconsistency management in software engineering: Survey and open research issues."" Handbook of software engineering and knowledge engineering 1 (2001): 329-380.",http://citeseerx.ist.psu.edu/viewdoc/download?doi=10.1.1.23.6123&rep=rep1&type=pdf,,Inconsistency management in software engineering: Survey and open research issues,"Spanoudakis, George; Zisman, Andrea",2001,229
45,doi:10.1162/105474698565686,dx.doi.org/10.1162/105474698565686,10.1162/105474698565686,Measuring Presence in Virtual Environments: A Presence Questionnaire,"Witmer, Bob G.; Singer, Michael J.",2006,2695
46,doi:10.1016/j.compedu.2010.10.020,dx.doi.org/10.1016/j.compedu.2010.10.020,10.1016/j.compedu.2010.10.020,Educational virtual environments: A ten-year review of empirical research (1999–2009),"Mikropoulos, Tassos A.; Natsis, Antonis",2011,224
47,"Association between Cellular-Telephone Calls and Motor Vehicle Collisions Donald A. Redelmeier,  and Robert J. Tibshirani, N Engl J Med 1997; 336:453-458 February 13, 1997 DOI: 10.1056/NEJM199702133360701",dx.doi.org/10.1056/NEJM199702133360701,10.1056/NEJM199702133360701,Association between cellular-telephone calls and motor vehicle collisions,"Redelmeier, Donald A.; Tibshirani, Robert J.",1997,1106
48,"A Mathematical Theory of Communication, Shannon, C. E., 1948",dx.doi.org/10.1145/584091.584093,10.1145/584091.584093,A mathematical theory of communication,"Shannon, Claude Elwood",2001,85376
49,"Information, a very short introduction, Floridi, L. 2010",https://books.google.com/books?hl=en&lr=&id=H6viR4Fs7lYC&oi=fnd&pg=PP2&ots=SnYCQ1yTif&sig=DCj1OD9gJa3kldRsrhJmkJGg8nI#v=onepage&q&f=false,,Information: A very short introduction,"Floridi, Luciano",2010,436
50,"doi: http://dx.doi.org/10.1136/bmj.e2598 (The effectiveness of SPARX, a computerised self help intervention for adolescents seeking help for depression: randomised controlled non-inferiority trial)",dx.doi.org/10.1136/bmj.e2598,10.1136/bmj.e2598,"The effectiveness of SPARX, a computerised self help intervention for adolescents seeking help for depression: randomised controlled non-inferiority trial","Merry, Sally N.; Stasiak, Karolina; Shepherd, Matthew; Frampton, Chris; Fleming, Theresa; Lucassen, Mathijs FG",2012,180
51,DOI: 10.1007/s10567-010-0069-9 (Computerised Cognitive Behavioural Therapy for the Prevention and Treatment of Depression and Anxiety in Children and Adolescents: A Systematic Review),dx.doi.org/10.1007/s10567-010-0069-9,10.1007/s10567-010-0069-9,Computerised Cognitive Behavioural Therapy for the Prevention and Treatment of Depression and Anxiety in Children and Adolescents: A Systematic Review,"Richardson, Thomas; Stallard, Paul; Velleman, Sophie",2010,137
52,"S Lim, R Buswell, T Le, S Austin, A Gibb, T Thope, (2011), ""Developments in construction-scale additive manufacturing processes"", Automation in Construction, Vol 21, No 1, pp 262 -268.",dx.doi.org/10.1016/j.autcon.2011.06.010,10.1016/j.autcon.2011.06.010,Developments in construction-scale additive manufacturing processes,"Lim, Sungwoo; Buswell, Richard A.; Le, Thanh T.; Austin, Simon A.; Gibb, Alistair GF; Thorpe, Tony",2012,58
53,"R Mueller, et al., (2016) ""Automated Additive Construction (AAC) for Earth and Space using in-situ resources"", Proceedings of the Fifteenth Biennial ASCE Aerospace Division International Conference on Engineering, Science, Construction, and Operations in Challenging Environments (Earth & Space 2016), Orlando Florida, USA, 11-15 April 2016.",http://oro.open.ac.uk/45865/1/3Dadditive_paper_final.pdf,,Automated Additive Construction (AAC) for Earth and Space Using In-situ Resources,"Mueller, Robert P.; Howe, Scott; Kochmann, Dennis; Ali, Hisham; Andersen, Christian; Burgoyne, Hayden; Chambers, Wesley; Clinton, Raymond; De Kestellier, Xavier; Ebelt, Keye; Gerner, Shai; Hofmann, Douglas; Hogstrom, Kristina; Ilves, Erika; Jerves, Alex; Keenan, Ryan; Keravala, Jim; Khoshnevis, Behrokh; Lim, Sungwoo; Metzger, Philip; Meza, Lucas; Nakamura, Takashi; Nelson, Andrew; Partridge, Harry; Pettit, Donald; Pyle, Rod; Reiners, Eric; Shapiro, Andrew; Singer, Russell; Tan, Wei-Lin; Vazquez, Noel; Wilcox, Brian; Zelhofer, Alex",2016,0
54,http://dl.acm.org/citation.cfm?id=563076,http://dl.acm.org/citation.cfm?id=563076,,Participatory Design: Principles and Practices,"Schuler, Douglas; Namioka, Aki",1993,2047
55,"Gurstein, M. (2007) What is Community Informatics (and Why Does It Matter)? https://arxiv.org/ftp/arxiv/papers/0712/0712.3220.pdf",http://arxiv.org/pdf/0712.3220.pdf,,What is community informatics (and why does it matter)?,"Gurstein, Michael ",2007,225
56,"Kukulska-Hulme, A., & Shield, L. (2008). An overview of mobile assisted language learning: from content delivery to supported collaboration and interaction. ReCALL, 20 (3), 271–289. http://oro.open.ac.uk/11617/",dx.doi.org/10.1017/S0958344008000335,10.1017/S0958344008000335,An overview of mobile assisted language learning: From content delivery to supported collaboration and interaction,"Kukulska-Hulme, Agnes; Shield, Lesley",2008,409
57,10.1080/01944360508976689,dx.doi.org/10.1080/01944360508976689,10.1080/01944360508976689,Urban informality: toward an epistemology of planning,"Roy, Ananya",2005,567
58,10.1016/j.progress.2009.06.002,dx.doi.org/10.1016/j.progress.2009.06.002,10.1016/j.progress.2009.06.002,The planned city sweeps the poor away…': Urban planning and 21st century urbanisation,"Watson, Vanessa",2009,213
59,10.1145/1978822.1978836,dx.doi.org/10.1145/1978822.1978836,10.1145/1978822.1978836,Animal-computer interaction: a manifesto,"Mancini, Clara",2011,60
60,10.1145/2468356.2468744 ,dx.doi.org/10.1145/2468356.2468744,10.1145/2468356.2468744,"Animal-computer interaction (ACI): changing perspective on HCI, participation and sustainability","Mancini, Clara",2013,33
61,"Categories of Art, Kendall Walton, 1970",dx.doi.org/10.2307/2183933,10.2307/2183933,Categories of Art,"Walton, Kendall L.",1970,482
62,"Towards a Fin de Siecle Ethics: Some Trends, Stephen Darwall, Allan Gibbard, Peter Railton, 1992",dx.doi.org/10.2307/2185045,10.2307/2185045,Toward Fin de siècle Ethics: Some Trends,"Darwall, Stephen; Gibbard, Allan; Railton, Peter",1992,398
63,"R.S. Mackintosh and A.M. Kobos, `Potential Model Representation of 6Li breakup through a simple inversion procedure'. Physics Letters 116B (1982) 95-98 ",dx.doi.org/10.1016/0370-2693(82)90983-2,10.1016/0370-2693(82)90983-2,Potential model representation of 6Li break-up through a simple inversion procedure,"Mackintosh, R. S.; Kobos, A. M.",1982,76
64,V.I. Kukulin and R.S. Mackintosh `The application of inversion to nuclear scattering' (Review Article) J. Phys. G.: Nucl. Part. Phys. 30 (2004) R1-R55,dx.doi.org/10.1088/0954-3899/30/2/R01,10.1088/0954-3899/30/2/R01,The application of inversion to nuclear scattering,"Kukulin, V. I.; Mackintosh, R. S.",2004,34
65,DOI: 10.1111/j.1467-9299.1991.tb00779.x,dx.doi.org/10.1111/j.1467-9299.1991.tb00779.x,10.1111/j.1467-9299.1991.tb00779.x,A public management for all seasons?,"Hood, Christopher",1991,8216
66,"Technology and History: ""Kranzberg's Laws"" Melvin Kranzberg Technology and Culture Vol. 27, No. 3 (Jul., 1986), pp. 544-560 Published by: The Johns Hopkins University Press and the Society for the History of Technology DOI: 10.2307/3105385 ",dx.doi.org/10.2307/3105385,10.2307/3105385,"Technology and History: ""Kranzberg's Laws""","Kranzberg, Melvin",1986,256
67,"Innovation, Technology, or History: What is the Historiography of Technology About? Technology and Culture, Volume 51, Number 3, July 2010 pp. 680-697",dx.doi.org/10.1353/tech.2010.0007,10.1353/tech.2010.0007,"Innovation, technology, or history: What is the historiography of technology about?","Edgerton, David",2010,44
68,http://doi.org/10.1057/sub.2009.25,dx.doi.org/10.1057/sub.2009.25,10.1057/sub.2009.25,Citizenship in flux: The figure of the activist citizen,"Isin, Engin F.",2009,282
69,http://www.sagepub.co.uk/booksProdDesc.nav?prodId=Book210767,https://uk.sagepub.com/en-gb/eur/handbook-of-citizenship-studies/book210767,,Handbook of Citizenship Studies,"Isin, Engin F.; Turner, Bryan S.",2002,388
70,http://doi.org/10.1007/s11663-013-9960-3,dx.doi.org/10.1007/s11663-013-9960-3,10.1007/s11663-013-9960-3,A Three-Dimensional Cellular Automata Model for Dendrite Growth with Various Crystallographic Orientations During Solidification,"Zhao, Yan; Chen, Dengfu; Long, Mujun; Arif, Tansel T.; Qin, Rongshan",2013,5
71,http://doi.org/10.1016/j.jcrysgro.2013.05.006,dx.doi.org/10.1016/j.jcrysgro.2013.05.006,10.1016/j.jcrysgro.2013.05.006,A three-dimensional cellular automata model coupled with finite element method and thermodynamic database for alloy solidification,"Zhao, Y.; Qin, R. S.; Chen, D. F.",2013,13
72,"Demski, J.S. (1973) The General Impossibility of Normative Accounting Standards, The Accounting Review 48 (4): 718-723.",http://sharing.mywordsolution.com/xtringfiles/2073_Assignment.pdf,,The general impossibility of normative accounting standards,"Demski, Joel S.",1973,308
73,"Zeff, S. A., 2012. The evolution of the IASC into the IASB, and the challenges in faces. The Accounting Review, 87 (3), 807-837.",dx.doi.org/10.2308/accr-10246,10.2308/accr-10246,"The Evolution of the IASC into the IASB, and the Challenges it Faces","Zeff, Stephen A.",2012,99
